<?xml version="1.0" encoding="UTF-8"?>
<!--W3C Schema generated by XMLSpy v2008 rel. 2 sp2 (http://www.altova.com)-->
<xs:schema xmlns:xs="http://www.w3.org/2001/XMLSchema"
 elementFormDefault="qualified">
	<xs:include schemaLocation="voiture.xsd"/>
	<xs:element name="numero" type="xs:string"/>
	<xs:element name="voie" type="xs:string"/>
	<xs:element name="ville" type="xs:string"/>
	<xs:element name="tauxInteret">
		<xs:complexType>
			<xs:attribute name="taux" use="required">
				<xs:simpleType>
					<xs:restriction base="xs:decimal">
						<xs:enumeration value="0.05"/>
					</xs:restriction>
				</xs:simpleType>
			</xs:attribute>
		</xs:complexType>
	</xs:element>
	<xs:element name="solde" type="xs:short"/>
	<xs:element name="raisonSociale">
		<xs:simpleType>
			<xs:restriction base="xs:string">
				<xs:enumeration value="afcepf"/>
			</xs:restriction>
		</xs:simpleType>
	</xs:element>
	<xs:element name="prenom">
		<xs:simpleType>
			<xs:restriction base="xs:string">
				<xs:enumeration value="chauvet"/>
			</xs:restriction>
		</xs:simpleType>
	</xs:element>
	<xs:element name="nom">
		<xs:simpleType>
			<xs:restriction base="xs:string">
				<xs:enumeration value="benoit"/>
			</xs:restriction>
		</xs:simpleType>
	</xs:element>
	<xs:element name="dateOuverture" type="xs:string"/>
	<xs:element name="compte">
		<xs:complexType>
			<xs:sequence>
				<xs:element ref="tauxInteret" minOccurs="0"/>
				<xs:element ref="solde"/>
				<xs:element ref="dateOuverture"/>
			</xs:sequence>
			<xs:attribute name="numero" type="xs:string" use="required"/>
		</xs:complexType>
	</xs:element>
	<xs:element name="codePostal" type="xs:int"/>
	<xs:element name="clients">
		<xs:complexType>
			<xs:sequence>
				<xs:element ref="client" maxOccurs="unbounded"/>
			</xs:sequence>
		</xs:complexType>
	</xs:element>
	<xs:element name="client">
		<xs:complexType>
			<xs:sequence>
				<xs:choice>
					<xs:element ref="raisonSociale"/>
					<xs:sequence>
						<xs:element ref="nom"/>
						<xs:element ref="prenom"/>
					</xs:sequence>
				</xs:choice>
				<xs:element ref="compte" maxOccurs="unbounded"/>
				<xs:element ref="adresse"/>
				<xs:element ref="voiture"/>
			</xs:sequence>
			<xs:attribute name="sexe" use="optional">
				<xs:simpleType>
					<xs:restriction base="xs:string">
						<xs:enumeration value="Masculin"/>
						<xs:enumeration value="FÃ©minin"/>
					</xs:restriction>
				</xs:simpleType>
			</xs:attribute>
			<xs:attribute name="type" use="required">
				<xs:simpleType>
					<xs:restriction base="xs:string">
						<xs:enumeration value="perso"/>
						<xs:enumeration value="pro"/>
					</xs:restriction>
				</xs:simpleType>
			</xs:attribute>
			<xs:attribute name="numero" use="required">
				<xs:simpleType>
					<xs:restriction base="xs:string">
						<xs:enumeration value="clt1"/>
						<xs:enumeration value="clt2"/>
					</xs:restriction>
				</xs:simpleType>
			</xs:attribute>
			<xs:attribute name="idAgence" use="required">
				<xs:simpleType>
					<xs:restriction base="xs:string">
						<xs:enumeration value="ag1"/>
					</xs:restriction>
				</xs:simpleType>
			</xs:attribute>
		</xs:complexType>
	</xs:element>
	<xs:element name="banque">
		<xs:complexType>
			<xs:sequence>
				<xs:element ref="clients"/>
				<xs:element ref="agences"/>
			</xs:sequence>
		</xs:complexType>
	</xs:element>
	<xs:element name="agences">
		<xs:complexType>
			<xs:sequence>
				<xs:element ref="agence"/>
			</xs:sequence>
		</xs:complexType>
	</xs:element>
	<xs:element name="agence">
		<xs:complexType>
			<xs:sequence>
				<xs:element ref="adresse"/>
			</xs:sequence>
			<xs:attribute name="id" use="required">
				<xs:simpleType>
					<xs:restriction base="xs:string">
						<xs:enumeration value="ag1"/>
					</xs:restriction>
				</xs:simpleType>
			</xs:attribute>
		</xs:complexType>
	</xs:element>
	<xs:element name="adresse">
		<xs:complexType>
			<xs:sequence>
				<xs:element ref="numero"/>
				<xs:element ref="voie"/>
				<xs:element ref="codePostal"/>
				<xs:element ref="ville"/>
			</xs:sequence>
		</xs:complexType>
	</xs:element>
</xs:schema>
